{
  "protocol_run_id": "20260629T225922Z_215045da",
  "config_sha256": "215045dab123c565c0090363a81c9d15686e7405b8571c0ac86a311e111432a6",
  "protocol_file": "protocols\\baseline_v1.json",
  "results": [
    {
      "symbol": "BTCUSDT",
      "window": "2024-01",
      "run_id": "20260629T225956Z_215045da",
      "core": {
        "net_return_pct": -18.547,
        "sharpe": -4.732,
        "max_drawdown_pct": -22.173,
        "trade_count": 414,
        "win_rate": 46.14,
        "avg_trade_net_pnl": -0.451008,
        "fees_paid": 216.702447,
        "gross_pnl": 29.984945,
        "net_pnl": -186.717502,
        "cost_drag_pct": 722.7042,
        "forecast_return_corr": 0.011539,
        "forecast_return_corr_pvalue": 0.76697,
        "sharpe_annualization": "sqrt(365) for daily Sharpe (crypto, 365 days/year)"
      },
      "per_regime": {
        "NOT_READY": {
          "bar_count": 104,
          "avg_forecast": 0.0
        },
        "trending": {
          "bar_count": 662,
          "avg_forecast": -0.10667,
          "trade_count": 414,
          "total_net_pnl": -186.717492
        }
      },
      "regime_validity": {
        "NOT_READY": {
          "forward_return_mean": 0.00034324,
          "forward_return_std": 0.00686451,
          "n_bars": 104,
          "informative": true
        },
        "trending": {
          "forward_return_mean": -1.285e-05,
          "forward_return_std": 0.00556225,
          "n_bars": 662,
          "informative": false
        }
      }
    },
    {
      "symbol": "BTCUSDT",
      "window": "2024-02",
      "run_id": "20260629T230036Z_215045da",
      "core": {
        "net_return_pct": -38.664,
        "sharpe": -9.076,
        "max_drawdown_pct": -38.524,
        "trade_count": 358,
        "win_rate": 46.37,
        "avg_trade_net_pnl": -1.081609,
        "fees_paid": 164.607892,
        "gross_pnl": -222.608266,
        "net_pnl": -387.216158,
        "cost_drag_pct": 73.9451,
        "forecast_return_corr": -0.017418,
        "forecast_return_corr_pvalue": 0.666647,
        "sharpe_annualization": "sqrt(365) for daily Sharpe (crypto, 365 days/year)"
      },
      "per_regime": {
        "NOT_READY": {
          "bar_count": 104,
          "avg_forecast": 0.0
        },
        "trending": {
          "bar_count": 614,
          "avg_forecast": -5.410831,
          "trade_count": 358,
          "total_net_pnl": -387.21614
        }
      },
      "regime_validity": {
        "NOT_READY": {
          "forward_return_mean": 0.00013108,
          "forward_return_std": 0.00331738,
          "n_bars": 104,
          "informative": true
        },
        "trending": {
          "forward_return_mean": 0.00062166,
          "forward_return_std": 0.0051392,
          "n_bars": 614,
          "informative": true
        }
      }
    },
    {
      "symbol": "BTCUSDT",
      "window": "2024-03",
      "run_id": "20260629T230119Z_215045da",
      "core": {
        "net_return_pct": -19.525,
        "sharpe": -6.791,
        "max_drawdown_pct": -21.836,
        "trade_count": 430,
        "win_rate": 49.3,
        "avg_trade_net_pnl": -0.454527,
        "fees_paid": 212.285304,
        "gross_pnl": 16.838524,
        "net_pnl": -195.44678,
        "cost_drag_pct": 1260.7121,
        "forecast_return_corr": 0.009511,
        "forecast_return_corr_pvalue": 0.807171,
        "sharpe_annualization": "sqrt(365) for daily Sharpe (crypto, 365 days/year)"
      },
      "per_regime": {
        "NOT_READY": {
          "bar_count": 104,
          "avg_forecast": 0.0
        },
        "trending": {
          "bar_count": 661,
          "avg_forecast": -1.326657,
          "trade_count": 430,
          "total_net_pnl": -195.446786
        }
      },
      "regime_validity": {
        "NOT_READY": {
          "forward_return_mean": 0.00081825,
          "forward_return_std": 0.0052502,
          "n_bars": 104,
          "informative": true
        },
        "trending": {
          "forward_return_mean": 8.575e-05,
          "forward_return_std": 0.00713032,
          "n_bars": 661,
          "informative": false
        }
      }
    },
    {
      "symbol": "BTCUSDT",
      "window": "2024-04",
      "run_id": "20260629T230159Z_215045da",
      "core": {
        "net_return_pct": -20.892,
        "sharpe": -7.676,
        "max_drawdown_pct": -23.631,
        "trade_count": 395,
        "win_rate": 46.33,
        "avg_trade_net_pnl": -0.529581,
        "fees_paid": 187.748381,
        "gross_pnl": -21.436119,
        "net_pnl": -209.1845,
        "cost_drag_pct": 875.8506,
        "forecast_return_corr": 0.004226,
        "forecast_return_corr_pvalue": 0.915155,
        "sharpe_annualization": "sqrt(365) for daily Sharpe (crypto, 365 days/year)"
      },
      "per_regime": {
        "NOT_READY": {
          "bar_count": 104,
          "avg_forecast": 0.0
        },
        "trending": {
          "bar_count": 638,
          "avg_forecast": 1.068378,
          "trade_count": 395,
          "total_net_pnl": -209.184496
        }
      },
      "regime_validity": {
        "NOT_READY": {
          "forward_return_mean": -0.00053659,
          "forward_return_std": 0.00630415,
          "n_bars": 104,
          "informative": true
        },
        "trending": {
          "forward_return_mean": -0.00020991,
          "forward_return_std": 0.00665005,
          "n_bars": 638,
          "informative": true
        }
      }
    },
    {
      "symbol": "BTCUSDT",
      "window": "2024-05",
      "run_id": "20260629T230243Z_215045da",
      "core": {
        "net_return_pct": -18.146,
        "sharpe": -5.99,
        "max_drawdown_pct": -21.031,
        "trade_count": 405,
        "win_rate": 41.73,
        "avg_trade_net_pnl": -0.448362,
        "fees_paid": 212.585108,
        "gross_pnl": 30.998603,
        "net_pnl": -181.586505,
        "cost_drag_pct": 685.7893,
        "forecast_return_corr": 0.017283,
        "forecast_return_corr_pvalue": 0.657142,
        "sharpe_annualization": "sqrt(365) for daily Sharpe (crypto, 365 days/year)"
      },
      "per_regime": {
        "NOT_READY": {
          "bar_count": 104,
          "avg_forecast": 0.0
        },
        "trending": {
          "bar_count": 662,
          "avg_forecast": -0.907024,
          "trade_count": 405,
          "total_net_pnl": -181.586504
        }
      },
      "regime_validity": {
        "NOT_READY": {
          "forward_return_mean": 0.00056389,
          "forward_return_std": 0.00798087,
          "n_bars": 104,
          "informative": true
        },
        "trending": {
          "forward_return_mean": 0.00010348,
          "forward_return_std": 0.004335,
          "n_bars": 662,
          "informative": true
        }
      }
    },
    {
      "symbol": "BTCUSDT",
      "window": "2024-06",
      "run_id": "20260629T230323Z_215045da",
      "core": {
        "net_return_pct": -19.686,
        "sharpe": -8.879,
        "max_drawdown_pct": -20.944,
        "trade_count": 371,
        "win_rate": 37.2,
        "avg_trade_net_pnl": -0.531251,
        "fees_paid": 191.658126,
        "gross_pnl": -5.435985,
        "net_pnl": -197.094112,
        "cost_drag_pct": 3525.7293,
        "forecast_return_corr": 0.006384,
        "forecast_return_corr_pvalue": 0.872137,
        "sharpe_annualization": "sqrt(365) for daily Sharpe (crypto, 365 days/year)"
      },
      "per_regime": {
        "NOT_READY": {
          "bar_count": 104,
          "avg_forecast": 0.0
        },
        "trending": {
          "bar_count": 638,
          "avg_forecast": 1.833807,
          "trade_count": 371,
          "total_net_pnl": -197.094111
        }
      },
      "regime_validity": {
        "NOT_READY": {
          "forward_return_mean": 0.00046035,
          "forward_return_std": 0.00351925,
          "n_bars": 104,
          "informative": true
        },
        "trending": {
          "forward_return_mean": -0.000175,
          "forward_return_std": 0.00388112,
          "n_bars": 638,
          "informative": true
        }
      }
    },
    {
      "symbol": "BTCUSDT",
      "window": "2024-07",
      "run_id": "20260629T230401Z_215045da",
      "core": {
        "net_return_pct": -15.213,
        "sharpe": -5.042,
        "max_drawdown_pct": -20.889,
        "trade_count": 390,
        "win_rate": 48.21,
        "avg_trade_net_pnl": -0.392461,
        "fees_paid": 221.224356,
        "gross_pnl": 68.164434,
        "net_pnl": -153.059922,
        "cost_drag_pct": 324.5451,
        "forecast_return_corr": 0.031763,
        "forecast_return_corr_pvalue": 0.414561,
        "sharpe_annualization": "sqrt(365) for daily Sharpe (crypto, 365 days/year)"
      },
      "per_regime": {
        "NOT_READY": {
          "bar_count": 104,
          "avg_forecast": 0.0
        },
        "trending": {
          "bar_count": 662,
          "avg_forecast": -2.476462,
          "trade_count": 390,
          "total_net_pnl": -153.059921
        }
      },
      "regime_validity": {
        "NOT_READY": {
          "forward_return_mean": -0.00143333,
          "forward_return_std": 0.00660801,
          "n_bars": 104,
          "informative": true
        },
        "trending": {
          "forward_return_mean": 0.00028894,
          "forward_return_std": 0.00527771,
          "n_bars": 662,
          "informative": true
        }
      }
    },
    {
      "symbol": "BTCUSDT",
      "window": "2024-08",
      "run_id": "20260629T230440Z_215045da",
      "core": {
        "net_return_pct": -6.625,
        "sharpe": -1.516,
        "max_drawdown_pct": -16.464,
        "trade_count": 370,
        "win_rate": 48.38,
        "avg_trade_net_pnl": -0.179407,
        "fees_paid": 217.578342,
        "gross_pnl": 151.197616,
        "net_pnl": -66.380726,
        "cost_drag_pct": 143.9033,
        "forecast_return_corr": 0.036015,
        "forecast_return_corr_pvalue": 0.354863,